school_id,cn_name,en_name,tags,introduction,apply_requirements,objectives,language_requirements,curriculum,success_cases,country
澳门大学,教育学哲学硕士（中文教育）,MPhil Education (Chinese Education),"社科,教育,教育学院",专业方向: 教育 入学时间: 8月 项目时长: 2年 项目学费: 87000澳门币/年,持有澳门大学认可的学士学位或同等学历。申请人也可能被要求具备其他知识或专业经验。申请人必须在学士学位学习中达到相当于C级或更高的总成绩其他入学要求包括：具有来自排名有竞争力的大学的学士学位；具有竞争力的本科GPA；精通英语；在高级研究和学术成就方面有很强的潜力,澳门大学教育学哲学硕士（中文教育）课程旨在培养中文教育领域的先进知识和研究技能。通过严格的课程，包括核心研究相关课程和专业学习计划，使毕业生具备应对复杂教育挑战所需的分析和批判性思维能力。,,"教育的当前问题 (Current Issues in Education) 教育研究中的定性方法、数据管理与分析 (Qualitative Methods, Data Management, and Analysis in Educational Research) 教育研究中的定量方法、数据管理与分析 (Quantitative Methods, Data Management, and Analysis in Educational Research) 论文 (Thesis) 语文教育中的课程设计 (Curriculum Design in Chinese Education) 行动研究 (Action Research) 课程、教学与学生技能评估 (Evaluation of Curriculum, Instruction and Student Performance) 语文教育学 (Chinese Pedagogy)",,澳门
澳门大学,欧盟法，国际法和比较法（英文）法学硕士,"LLM European Union Law, International Law and Comparative Law (English language)","社科,法律,法学院",专业方向: 法律 入学时间: 8月 项目时长: 2年 项目学费: 87000澳门币/年,持有澳门大学认可的学士学位或同等学历。申请人也可能被要求具备其他知识或专业经验。申请人必须在学士学位学习中达到相当于C级或更高的总成绩,为了加强澳门历史上作为中国及欧洲各国交流之桥梁作用，以及鉴于中国与欧洲及世界各国不断增强的联系，法学院开设以欧洲联盟法、国际法和比较法为专业领域的法学硕士课程，以便培养更多欧洲联盟法、国际法和比较法领域的符合资格的法律人才、专业人士和学者。课程始于2003/2004学年，其目的是提供在欧洲联盟法、国际法和比较法领域的优质教育和培训，确立并加强澳门大学法学院作为本地区研究澳门法律、欧洲大陆法、国际法和比较法的重要学术机构的地位。,,欧盟的条约改革 (Treaty Reforms in the EU) 当代国际法问题 (Contemporary Issues in International Law) 比较法律制度 (Comparative Legal Systems) 研究方法与法律写作 (Research Methodology and Legal Writing) 欧洲联盟机构法 (Institutional Law of the European Union) 欧盟经济法 (Economic Law of the European Union) 国际经济法 (International Economic Law) 国际组织法 (Law of International Organizations) 普通法 (Common Law) 比较合同法 (Comparative Contract Law) 项目报告 (Project Report) 欧洲联盟的外部法律和政策 (External Law and Policy of the European Union) 欧盟竞争法 (EU Competition Law),,澳门
澳门科技大学,公益与社会组织管理硕士,Master of Charity and Social Organization Management,"商科,管理,商学院",专业方向: 管理 入学时间: 9月 项目时长: 2年 项目学费: 120000港币/年,不局限于任何专业,公益与社会组织管理硕士学位课程的目标是为了培养更多具备有慈善公益及各类型社会组织管理理论基础及实践能力的专业化管理人才。 毕业生的就业前景广阔，例如进一步从事更深入理论相关的研究工作，或是加入各类型慈善公益及社会组织管理机构 (包括政府部门、各大型企业等)，从事管理的一线工作或内部管理工作等，都是极佳的就业选择。,,公益筹款 (Charity Fundraising) 社会科学研究方法 (Social Science Research Methods) 社会组织管理概论 (Introduction to Social Science Management) 社会企业与社会创新 (Social Enterprise and Social Innovation) 社会组织财务管理 (Financial Management for Social Organizations) 社会组织人力资源管理 (Human Resource Management for Social Organizations) 公共关系与公益传播 (Public Relations and Charity Communications) 社会组织调查研究 (Survey Research for Social Organizations),,澳门
澳门大学,教育学哲学硕士（学校辅导）,MPhil Education (School Counseling),"社科,教育,教育学院",专业方向: 教育 入学时间: 8月 项目时长: 2年 项目学费: 87000澳门币/年,持有澳门大学认可的学士学位或同等学历。申请人也可能被要求具备其他知识或专业经验。申请人必须在学士学位学习中达到相当于C级或更高的总成绩其他入学要求包括：具有来自排名有竞争力的大学的学士学位；具有竞争力的本科GPA；精通英语；在高级研究和学术成就方面有很强的潜力,澳门大学教育学哲学硕士（学校辅导）课程旨在培养学校辅导领域的先进知识和研究技能。通过严格的课程，包括核心研究相关课程和专业学习计划，使毕业生具备应对复杂教育挑战所需的分析和批判性思维能力。,,"教育的当前问题 (Current Issues in Education) 教育研究中的定性方法、数据管理与分析 (Qualitative Methods, Data Management, and Analysis in Educational Research) 教育研究中的定量方法、数据管理与分析 (Quantitative Methods, Data Management, and Analysis in Educational Research) 论文 (Thesis) 支持有情绪和行为困难的学生 (Supporting Students with Emotional and Behavioral Difficulties) 咨询专业的理论 (Theories in the Counseling Profession) 高级学校咨询技巧 (Advanced School Counseling Skills) 学校环境中的职业咨询 (Career Counseling in School Environments)",,澳门
澳门科技大学,法律硕士,Juris Master,"社科,法律,法学院",专业方向: 法律 入学时间: 9月 项目时长: 2年 项目学费: 130000港币/年,专业不限，但法学专业除外,法律硕士生需要在政府机构、律师事务所或其它法律实务部门完成2-3个月的实习和实践，并提交实习报告，为了将书本中的法律运用于实际，并积累实践经验。,,法理学 (JURISPRUDENCE) 法制史 (LEGAL HISTORY) 宪法与基本法 (CONSTITUTIONAL LAW AND THE BASIC LAW) 民法学 (CIVIL LAW) 刑法学 (CRIMINAL LAW) 刑事诉讼法学 (CRIMINAL PROCEDURE LAW) 民事诉讼法学 (CIVIL PROCEDURE LAW) 行政法与行政诉讼法 (ADMINISTRATIVE LAW AND ADMINISTRATIVE LITIGATION LAW) 经济法 (ECONOMIC LAW) 商法 (COMMERCIAL LAW) 国际法原理 (PRINCIPLES OF INTERNATIONAL LAW),,澳门
澳门科技大学,供应链管理学硕士,Master of Supply Chain Management,"商科,供应链管理,商学院",专业方向: 供应链管理 入学时间: 9月 项目时长: 2年 项目学费: 120000港币/年,不局限于任何专业,随着经济结构调整、产业转型升级和全球化的发展，企业之间的竞争已经转变成供应链之间的竞争。实践证明，通过供应链管理可以大幅降低企业成本，提高企业生产率，推动企业快速发展。2017年10月13日国务院办公厅发佈了关于积极推进供应链创新与应用的指导意见，其中之一就是要求高等院校加快培养高层次供应链人才。同时，为适应澳门经济适度多元化的需要，顺应供应链全球化发展趋势，商学院于2020年新开设供应链管理硕士课程（MSCM）。 在为期两年的全日制学习中，传授学生高阶的供应链管理理论、工具和分析方法，培养学生综合运用专业知识解决实际问题的研究能力，帮助学生挖掘自身的创新潜力，使之能够成为胜任供应链相关岗位、具备国际视野的高级供应链分析人才。,,全球营运与供应链管理 (Global Operations and Supply Chain Management) 管理科学与实务 (Management Science with Practice) 研究设计与分析 (Research Design and Analysis) 供应链实证分析 (Empirical Analysis in Supply Chain Management) 商务博弈论 (Business Game Theory) 商务优化理论 (Business Optimization Theory) 供应链建模与彷真方法 (Supply Chain Modeling and Simulation) 会展项目管理 (Project Management in Convention and Exhibition),,澳门
澳门理工大学,运动及体育理学硕士,MSc Sports and Physical Education,"社科,体育,健康科学及体育学院",专业方向: 体育 入学时间: 8月 项目时长: 2年 项目学费: 85000澳门币/年,具有学士学位或同等学历；或 正修读上述学历课程最后一年。 其他所需文件： - 运动奖项（如有） - 内地往届学士毕业生须提交应届内地全国研究生招生考试初试成绩，且达国家一区分数线或以上,本课程旨在培养高水平运动及体育专才，透过全面剖析体育范畴的理论与研究动态，有效提升学生体育教学、运动训练等专业技能，专题探讨运动心理、体育管理与学校体育，培育学生管理技巧与研究能力。,,高级体育运动心理学 (Advanced Psychology of Sports and Exercise) 运动技能学习原理 (Principles of Motor Learning) 现代学校体育专题 (Special Topics in Current Physical Education in Schools) 体适能评定理论与评价方法 (Theory and Methodology of Physical Fitness Assessment) 体育科研方法 (Methodology of Research in Physical Education) 运动及体育管理专题 (Study of Sports Management) 教练方法 (Methods of Coaching) 游戏创编 (Design and Practice of Sports Games) 体育多元统计方法 (Multivariate Statistical Methods in Sport Science) 体能训练 (Training of Strength and Conditioning) 运动与营养 (Exercise and Nutrition) 运动员身体机能评定 (Monitoring Body Functional Performance of Athletes) 论文 (Thesis),,澳门
澳门科技大学,管理硕士,Master of Management Studies,"商科,管理,商学院",专业方向: 管理 入学时间: 9月 项目时长: 2年 项目学费: 127500港币/年,不局限于任何专业,经济全球化的快速进程促使整个社会对管理类人才的需求增快。与此同时，随着技术和文化的不断发展，管理的思想和技术也产生令人惊喜的进步，管理领域在需要管理实践人才的同时也更需要管理类的研究人才和教学人才。管理硕士学位就是为了培养管理类的研究人才而设立，课程面向各专业的本科应届毕业生招生，并且欢迎有工作经验并有志从事管理研究工作的人士入读。,,营销管理 (MARKETING MANAGEMENT) 研究方法 (RESEARCH METHODOLOGY) 管理经济学 (MANAGERIAL ECONOMICS) 组织行为学 (ORGANIZATIONAL BEHAVIOR) 管理导论 (INTRODUCTION TO MANAGEMENT) 统计学 (STATISTICS) 管理决策方法 (MANAGERIAL DECISION METHODS) 商业伦理 (BUSINESS ETHICS),,澳门
澳门大学,国际商法（英文）法学硕士,LLM International Business Law (English Language),"社科,法律,法学院",专业方向: 法律 入学时间: 8月 项目时长: 2年 项目学费: 87000澳门币/年,持有澳门大学认可的学士学位或同等学历。申请人也可能被要求具备其他知识或专业经验。申请人必须在学士学位学习中达到相当于C级或更高的总成绩,澳门大学法学院自2006/2007学年已经开始面向法学生和非法学生开设国际商法的研究生课程。该课程旨在为商业从业者（包括银行、保险、贸易、不动产、博彩业等其他部门）提供学习商事交易中涉及的澳门法和国际法的机会。在经济全球化的时代，了解澳门和其他包括中国内地、香港、欧盟和国外地区现行的国际法律法规标准尤为重要。该课程的弹性的框架包括各个国际法、区域法、和澳门法领域的选修课。该课程的教学目的在于实践应用，以满足企业和公司及其员工的需求。在诸如澳门这样的微小而开放的经济体中，在经济全球化的时代，了解澳门和其他包括中国内地、香港、欧盟和国外地区现行的国际法律法规标准尤为重要。澳门的商业和贸易发展已有数个世纪，如今，澳门也开始新的经济增长时期。在澳门从事商业活动或者从事跨境商业活动要求投资者、律师和公司管理者了解澳门和国际法律制度。该国际商法课程为英文授课，以提供学员必要的国际商法的英文法律背景。,,跨国法 (Transnational Law) WTO与区域贸易法 (WTO and Regional Trade Law) 争议解决 (Dispute Resolution) 创意经济中的知识产权法 (Intellectual Property Law in the Creative Economy) 研究方法与法律写作 (Research Methodology and Legal Writing) 项目报告 (Project Report) 欧盟竞争法 (EU Competition Law) 欧盟环境法 (EU Environmental Law) 欧盟自然资源和能源法 (EU Natural Resources and Energy Law) 欧盟的条约改革 (Treaty Reforms in the EU) 外国投资法 (Foreign Investment Law) 国际刑法与人道主义法 (International Criminal and Humanitarian Law) 人权和难民法 (Human Rights and Refugee Law),,澳门
澳门城市大学,计算机科学硕士,Master of Computer Science,"工科,计算机,数据科学研究院",专业方向: 计算机 入学时间: 9月 项目时长: 2年 项目学费: 110000港币/年,报考者须具有学士学位或同等学历。前置学历专业为计算机科学、信息科学、人工智能、数据科学、信息安全、数据分析、数据管理、数学、统计学、机器学习、数据採集、数据库等领域及相关专业者优先。 往届本科毕业生需参加2025年全国硕士研究生招生考试且初试总成绩过国家A类线。 应届本科毕业生不受考研限制。,配合澳门特別行政区发展规划以及国家数字经济发展战略规划，计算机科学硕士课程总体培养目標为： 具备扎实的自然科学、信息科学理论基础； 具有人工智能与信息安全专业领域知识的人才； 具有从事科学研究和技术开发的能力，产学研结合的务实型人才； 具有创新意识和终身学习动力的跨领域成长型人才； 具有国际视野、中国情怀和跨文化合作能力的科研和应用型人才； 除了总体目标的覆盖內容以外，“人工智能”方向的培养目標还包括： 培养国家与澳门发展所需的爱国爱澳的，掌握数据科学、人工智能相关知识，理论与实务结合、分析与应用兼备的专业人才； 可以在不同的领域灵活运用所学的知识，解决复杂情况下多变的实际问题的交叉型人才； “信息安全” 方向的培养目标还包括： 培养国家与澳门发展所需的的爱国爱澳的信息安全人才，为数据系统建立技术、管理上的安全保护。 培养熟练掌握安全检测、加密技术、防护策略、防御技术等基础知识，解决复杂情境下的实际问题的综合型人才。,,高级编程与软件工程 (Advanced Programming and Software Engineering) 高级计算机体系结构 (Advanced Computer Architecture) 计算机通信与网络 (Computer Communication and Networks) 学术专题项目 (Special Academic Topic) 人工智能和计算智能 (Artificial Intelligence and Computational Intelligence) 神经网络 (Neural Networks) 机器学习算法与应用 (Machine Learning Algorithms and Applications) 计算机体系安全 (Cybersecurity) 计算机网络安全和安全协议 (Computer Network Security and Security Protocols) 密码学 (Cryptography) 时间序列分析 (Time Series Analytics) 并行计算方法 (Parallel Computing Methods) 机器人原理与脑计算 (Robotics Principles and Brain Computing) 信息隐私和应用 (Information Privacy and Applications) 大数据分析 (Big Data Analytics),,澳门
澳门大学,葡萄牙语言及跨文化研究哲学硕士,MPhil Portuguese Language and Intercultural Studies,"社科,语言,人文学院",专业方向: 语言 入学时间: 8月 项目时长: 2年 项目学费: 87000澳门币/年,持有澳门大学认可的学士学位或同等学历。申请人也可能被要求具备其他知识或专业经验。申请人必须在学士学位学习中达到相当于C级或更高的总成绩,该计划旨在发展学生的葡萄牙语世界语言，语言学，文学和文化知识，并提高其文化素养和批判性思维能力。现有两个专业，即文学和跨文化研究与应用语言学。在完成该课程的文学和跨文化研究专业后，学生将具备技能，可以批判性地分析和理解葡萄牙语在创造性和传播性文学中的发展和使用，这将在其硕士学位论文中得到证明。在完成该课程的应用语言学专业后，预计学生将具备解决解决涉及葡萄牙语的现实问题并在竞争激烈的就业市场中取得成功所需的许多技能和大量知识。,,文学文化研究方法 I (Literary & Cultural Studies Method I) 文学文化研究方法 II (Literary & Cultural Studies Method II) 论文与研究写作研讨会 (Thesis and Research Writing Seminar) 论文 (Thesis) 专业葡萄牙语 I (Portuguese for Professional Purposes I) 专业葡萄牙语 II (Portuguese for Professional Purposes II) 现代葡语文学 (Modern Lusophone Literature) 语言学方法 I (Linguistics Method I) 语言学方法 II (Linguistics Method II) 葡萄牙语作为第二语言的教学方法 (Methodology of Teaching Portuguese as a Second Language) 葡萄牙语阅读能力的培养 (Developing Reading Skills in Portuguese as a Foreign Language) 葡萄牙社会语言学 (Portuguese Sociolinguistics),,澳门
澳门大学,中国文学哲学硕士,MPhil Chinese Literature,"社科,文化,人文学院",专业方向: 文化 入学时间: 8月 项目时长: 2年 项目学费: 87000澳门币/年,持有澳门大学认可的学士学位或同等学历。申请人也可能被要求具备其他知识或专业经验。申请人必须在学士学位学习中达到相当于C级或更高的总成绩,学习中国文学，包括古代文学、现当代文学，以及与中国文学相关的文学理论等，提高学员的中国文学认识水平，更新学员对当前中国文学研究发展的认知，扩阔学员的眼界，培养学员从新方向、新视角、新理论等对中国文学进行研究，为继续研究和深造中国文学打下坚实的基础。,,中国古典文学专题 (Special topic of Chinese classical literature) 中国现代文学专题 (Special topics in modern Chinese Literature) 文学理论专题 (Special topics in literary theory) 论文 (Thesis) 古代文学研究方法 (Research methods of ancient literature) 现代文学研究方法 (Research methods of modern literature) 中国文学专题 I (Chinese Literature I) 中国文学专题 II (Chinese Literature II) 中国古代文体专题 (Special topics on ancient Chinese style) 中国现代文体专题 (Modern Chinese style),,澳门
澳门大学,中药学哲学硕士,MPhil Chinese Medicinal Science,"社科,药学,中华医药研究院",专业方向: 药学 入学时间: 8月 项目时长: 2年 项目学费: 87000澳门币/年,申请人必须在认可机构完成至少4年的学士学位或同等学历的相关领域,中医药科学硕士（CMS）由我们中医药科学研究所（ICMS）的专业教职人员团队提供，该研究所于2002年在澳门成立，是首家以研究为导向的研究所。在过去的16年中，ICMS自豪地主办了中药质量研究国家重点实验室，这是中药广泛领域中的第一个国家重点实验室，并且在全国和全球范围内均获得了快速增长和日益增长的影响。这项计划已被设计以响应中国的研究和开发。它的目的是培养高级研究人员，使其在CMS的跨学科领域中精通理论和实践。成功地成为研究者所必需的知识，技能和发展活动已包括在核心课程中，并辅以各种选修课程。,,中药研究导论 (Introduction to Research in Chinese Medicinal Science) 中药质量控制 (Quality Control of Chinese Medicine) 药理学和安全性评估 (Pharmacology and Safety Evaluation) 药品和保健品的开发 (Development of Drugs and Health Products) 药物科学 (Pharmaceutical Science) 药物筛选的目标和模型 (Targets and Models for Drug Screen) 系统生物学 (Systems Biology) 生物医学信息学 (Biomedical Informatics) 医疗技术管理 (Medical Technology Management ) 临床医学中的新兴材料 (Emerging Materials in Clinical Medicine) 当代中医药研究进展 (Progress in Contemporary Study of Chinese Medicine) 药代动力学和代谢组学在药物开发中的应用 (Application of Pharmacokinetics and Metabonomics in Drug Development) 学术论文 (Academic Thesis),,澳门
澳门大学,欧洲事务社会科学硕士,MSocSc European Studies,"社科,国际关系,社会科学学院",专业方向: 国际关系 入学时间: 8月 项目时长: 2年 项目学费: 87000澳门币/年,持有澳门大学认可的学士学位或同等学历。申请人也可能被要求具备其他知识或专业经验。申请人必须在学士学位学习中达到相当于C级或更高的总成绩 具有相关本科培训或工作经验的申请人，最好是经济学，政治学，法学，欧洲语言或其他相关学科，将在入学评估中给予更高的优先权,澳门大学与澳门欧洲研究所（IEEM）合作提供欧洲研究文学硕士学位。这项为期两年的跨学科课程为学生提供了从各种角度更深入地研究欧洲一体化和欧洲研究过程的机会。课程工作分为四个模块：通用基金会，经济方面，法律研究和欧盟的国际关系。所有课程均由欧洲各大学和学院以及澳门大学的顶尖学者讲授。该课程特别适合那些希望在欧洲研究和国际关系理论上建立强大知识基础以及在社会科学分析方面奠定坚实基础的人。MASS-EUS计划的校友已经在中国和国外寻求成功的职业，包括商业，政府，外交机构，国际组织，非营利部门和学术界。,,公共政策与政治 (Public Policy and Politics) 政府与欧盟治理 (Governments and EU Governance) 社会政策与欧洲认同 (Social Policy and European Identity) 欧洲一体化的历史 (History of European Integration) 研究方法 (Research Methods) 学术写作 (Academic Writing) 宏观经济学导论 (Introduction to   Macroeconomics) 欧洲一体化理论 (Theory of European   Integration) 欧盟经济政策 (Economic Policies of the EU) 世界语境下的欧洲货币联盟 (The European Monetary   Union in the World Context) 全球化与欧盟的外国直接投资 (Globalization & EU’s Foreign Direct Investment) 欧盟与可持续发展 (EU and Sustainable Development) 欧洲经济精选话题 (Selected Topics in European Economy),,澳门
澳门科技大学,刑事司法硕士,Master of Laws in Criminal Justice,"社科,法律,法学院",专业方向: 法律 入学时间: 9月 项目时长: 2年 项目学费: 120000港币/年,不局限于任何专业,本课程讲解和讨论犯罪学的研究方法，分析犯罪的原因和类型，探讨预防犯罪的刑事司法和综合对策，并且系统介绍犯罪学的各个学派及其主要理论学说。本课程将讲解西方古典学派、实证主义学派、犯罪生物学学派、犯罪心理学学派、现代社会学学派等各派理论，介绍中国犯罪学的研究成果，并且运用犯罪学的各种理论分析中国和港澳地区犯罪的起因和现象，寻求有效控制犯罪的刑事司法对策和综合预防对策。,,犯罪学原理 (THEORIES OF CRIMINOLOGY) 犯罪学专题 (SPECIAL TOPICS IN CRIMINOLOGY) 警察学专题 (SPECIAL TOPICS IN POLICING) 刑事证据学 (CRIMINAL EVIDENCE) 比较刑事司法 (COMPARATIVE CRIMINAL JUSTICE) 侦查学研究 (RESEARCH ON CRIMINAL INVESTIGATION) 监狱与矫正学研究 (RESEARCH ON PRISONS AND CORRECTIONS) 国际犯罪与跨国犯罪专题 (SPECIAL TOPICS IN INTERNATIONAL AND TRANSNATIONAL CRIMES) 犯罪被害人学 (CRIMINAL VICTIMOLOGY) 指导阅读 (DIRECTED READINGS),,澳门
