school_id,cn_name,en_name,tags,introduction,apply_requirements,objectives,language_requirements,curriculum,success_cases,country
澳门理工大学,教育硕士（文化传播与教育）,Master of Education (Cultural Communication and Education),"社科,教育,人文及社会科学学院",专业方向: 教育 入学时间: 8月 项目时长: 2年 项目学费: 85000澳门币/年,具有学士学位或同等学历；或 正修读上述学历课程最后一年。 其他所需文件： - 简历上所列的成果材料及经历副本 - 内地往届学士毕业生须提交应届内地全国研究生招生考试初试成绩，且达国家一区分数线或以上,澳门理工大学教育硕士（文化传播与教育）项目专为教育、旅游、文化遗产和文化传播领域的从业者设计。通过跨学科探索，强化学生的学术知识、综合素质和教育创新能力，培养教育、科研、人文、社会服务、文化遗产等领域的专业人才。,,"跨文化交际与教育实践 (Intercultural Communication and Education Practice) 东西方的人文与文化 (Humanism & Culture in East and West) 课堂评估与创新教学法 (Classroom Assessment and Innovative Pedagogy) 学习和质量保证 (Learning and Quality Assurance) 项目报告 (Project Report) 研究方法 (Research Methods) 社会及公民教育 (Social and Civic Education) 公共历史和历史教育 (Public History and History Education) 中国传统文化的传承与实践 (Heritage and Practice of Chinese Traditional Culture) 艺术与艺术教育 (Art and Art Education) 文化遗产与博物馆 (Cultural Heritage & Museums) 澳门历史文化教育 (History, Culture and Education in Macao)",,澳门
澳门大学,教育学哲学硕士（科学教育）,MPhil Education (Science Education),"社科,教育,教育学院",专业方向: 教育 入学时间: 8月 项目时长: 2年 项目学费: 87000澳门币/年,持有澳门大学认可的学士学位或同等学历。申请人也可能被要求具备其他知识或专业经验。申请人必须在学士学位学习中达到相当于C级或更高的总成绩其他入学要求包括：具有来自排名有竞争力的大学的学士学位；具有竞争力的本科GPA；精通英语；在高级研究和学术成就方面有很强的潜力,澳门大学教育学哲学硕士（科学教育）课程旨在培养科学教育领域的先进知识和研究技能。通过严格的课程，包括核心研究相关课程和专业学习计划，使毕业生具备应对复杂教育挑战所需的分析和批判性思维能力。,,"教育的当前问题 (Current Issues in Education) 教育研究中的定性方法、数据管理与分析 (Qualitative Methods, Data Management, and Analysis in Educational Research) 教育研究中的定量方法、数据管理与分析 (Quantitative Methods, Data Management, and Analysis in Educational Research) 论文 (Thesis) 行动研究 (Action Research) 课程设计与实施 (Curriculum Design and Implementation) 科学教育中的课程设计 (Curriculum Design in Science Education) 科学教育法 (Science Pedagogy)",,澳门
澳门大学,犯罪学与刑事司法社会科学硕士,MSocSc Criminology and Criminal Justice,"社科,社会学与社工,社会科学学院",专业方向: 社会学与社工 入学时间: 8月 项目时长: 2年 项目学费: 87000澳门币/年,持有澳门大学认可的学士学位或同等学历。申请人也可能被要求具备其他知识或专业经验。申请人必须在学士学位学习中达到相当于C级或更高的总成绩 优先考虑具有犯罪学/刑事司法，法律，社会学，心理学，社会工作，公共卫生，政治学，公共管理和经济学的学士学位的申请人,犯罪学和刑事司法硕士课程旨在取得卓越的学术成就，满足当地刑事司法界的需求，并为澳门及其他地区的更安全，更公正的社会做出贡献。它提供了严格的课程，将基础学术培训与对刑事司法政策的应用重点相结合。该计划为在政府和非政府机构及相关机构工作的合格大学毕业生和专业人员提供高级教育。它旨在提高学生的学术知识，批判性思维能力，解决问题的能力以及研究能力，这将使他们为将来成为有能力的管理员，从业人员，教育工作者，研究人员和服务提供者的角色做好准备。它还为学生提供了更进一步的学习的准备，这些学习将获得犯罪学或相关领域的博士学位。,,犯罪学与刑事司法 (Criminology and Criminal Justice) 犯罪学理论 (Criminological Theories) 研究方法 (Research Methods) 应用统计学 (Applied Statistics) 学术/应用论文 (Academic/Applied Thesis) 治安 (Policing) 药物滥用和成瘾 (Substance Abuse and Addiction) 比较犯罪学 (Comparative Criminology) 预防犯罪 (Crime Prevention) 高级统计 (Advanced Statistics) 犯罪心理学 (Criminal Psychology) 犯罪学和刑事司法专题 I (Special Topics in Criminology and Criminal Justice I) 犯罪学和刑事司法专题 II (Special Topics in Criminology and Criminal Justice II),,澳门
澳门大学,法学硕士（中文）,LLM Chinese Language,"社科,法律,法学院",专业方向: 法律 入学时间: 8月 项目时长: 2年 项目学费: 87000澳门币/年,持有澳门大学认可的学士学位或同等学历。申请人也可能被要求具备其他知识或专业经验。申请人必须在学士学位学习中达到相当于C级或更高的总成绩,澳大法学院从2001年起开设中文法学硕士课程。课程目的为提高学生的研究能力和学术水准，使母语为中文的本地和非本地具法律学位的人士有机会继续深入研习法律。,,宪法 (Constitutional Law) 澳门基本法 (Macao Basic Law) 行政法与行政诉讼法 (Administrative Law and Administrative Litigation Law) 法理学与法哲学 (Jurisprudence and Legal Philosophy) 刑法 (Criminal Law) 刑事诉讼法 (Crimial Procedural Law) 犯罪学与刑事司法 (Criminology and Criminal Justice) 外国刑法 (Foreign Criminal Law) 产权法 (Property Law) 合同法 (Contract Law) 版权和工业产权法 (Copyright and Industrial Property Law) 生物技术法律和政策 (Biotechnology Law and Policy) 国际私法 (International Private Law) 商业组织法 (Commercial Organizational Law) 国际货物销售法 (International Sale of Goods Law) 项目报告 (Project Report) 法律经典 (Classics in Law) 欧洲经济贸易法 (Economic and Trade Law of Europe) 世界贸易组织法 (World Trade Organization Law) 海商法 (Maritime Law),,澳门
澳门大学,海岸带环境与安全理学硕士,MSc Coastal Environment and Safety,"工科,土木工程,科技学院",专业方向: 土木工程 入学时间: 8月 项目时长: 2年 项目学费: 87000澳门币/年,持有澳门大学认可的学士学位或同等学历。申请人也可能被要求具备其他知识或专业经验。申请人必须在学士学位学习中达到相当于C级或更高的总成绩,澳门大学海岸带环境与安全理学硕士旨在教育和培养学生成为具有丰富的科学知识、良好的工程实践技能和领导能力的土木工程师；并为了接受国际标准的高等教育做准备。,,"海洋学概论 (Introduction to Oceanography) 水动力学与洪水 (Hydrodynamics and Floods) 沿海水域与废水的处理原理与过程 (Coastal Water and Wastewater Treatment Principles and Processes) 项目报告 (Project Report) 实习与报告 (Internship and Report) 海洋生态学 (Marine Ecology) 养殖水化学 (Aquatic Chemistry) 大气化学 (Atmospheric Chemistry) 沿海污染:污染物的来源、命运与影响 (Coastal Pollution: Sources, Fate and Effects of Pollutants) 减灾专题 (Special Topics in Hazard Alleviation) 海岸带环境专题 (Special Topics in Coastal Environment) 山体滑坡机制、缓解和风险评估 (Landslides Mechanisms, Mitigation and Risk Assessment) 高级计算方法:原理与应用 (Advanced Computational Methods: Principles and Applications) 海岸流体力学与风暴潮 (Coastal Fluid Mechanics and Storm Surge) 泥沙输运与侵蚀 (Sediment Transport and Erosion)",,澳门
澳门城市大学,金融学理学硕士（中文学制）,MSc Finance (Chinese),"商科,金融,金融学院",专业方向: 金融 入学时间: 9月 项目时长: 2年 项目学费: 110000港币/年,往届本科毕业生需参加2025年全国硕士研究生招生考试且初试总成绩过国家A类线。 应届本科毕业生不受考研限制。,毕业生可在银行业、保险业、证券业、会计行业、政府机构、跨国组织、高校及其他教育机构等部门从事资产管理、投资咨询、公司理财、市场分析、金融教育等工作。,,金融经济学  (Financial Economics) 金融市场与治理 (Financial Markets and Governance) 金融机构与风险管理 (Financial Institutions and Risk Management) 行为金融学 (Behavioral Finance) 投资组合管理 (Investment Portfolio Management) 融资租赁 (Lease Finance) 绿色金融 (Green Finance) 金融科技 (FinTech) 金融工程 (Financial Engineering) 金融专题讲座 (Special Topic in Finance) 学位论文 (Dissertation) 收购与合并  (Mergers and Acquisitions) 财务报表分析 (Financial Statement Analysis) 保险学 (Insurance) 案例研究 (Case Study),,澳门
澳门大学,全球公共卫生理学硕士,MSc Global Public Health,"社科,公共卫生,健康科学学院",专业方向: 公共卫生 入学时间: 8月 项目时长: 2年 项目学费: 87000澳门币/年,持有澳门大学认可的学士学位或同等学历。申请人也可能被要求具备其他知识或专业经验。申请人必须在学士学位学习中达到相当于C级或更高的总成绩,全球公共卫生领域是预防疾病、改善健康和提高全民生活品质的科学领域。全球公共卫生涵盖跨学科研究领域，涉及流行病学、生物统计学、环境卫生、营养学、食品安全、社会医药、卫生服务和风险管理方面的知识。全球公共卫生的认识对改善社会公共利益和管理影响全球社区之灾害至为重要。 澳门大学全球公共卫生理学硕士课程旨在教育和培训学生具有全球公共卫生科学、公共卫生流行病学、统计分析、流行病和卫生政策管理以及相关风险管理知识。,,生物统计学 (Bio-Statistics) 生物医学科学 (Biomedical Sciences) 毒理学与环境卫生 (Toxicology and Environmental Health) 流行病学 (Epidemiology) 高级营养与食品安全 (Advanced Nutrition and Food Safety ) 卫生系统与政策 (Health Systems and Policy) 全球卫生危机案例分析：流行病管理 (Case Analysis of Global Health Crisis: Managing Epidemics ) 人工智能在医学领域的应用 (Artificial Intelligence in Medicine) 数字生物医学 (Digital Biomedicine) 医疗分析 (Healthcare Analytics) 社会医学 (Social Medicine) 项目报告 (Project Report),,澳门
澳门城市大学,工商管理硕士（中文学制）,Master of Business Administration (Chinese),"商科,工商管理,商学院",专业方向: 工商管理 入学时间: 9月 项目时长: 2年 项目学费: 120000港币/年,具有本科毕业或同等学历，有对口工作经验有优势 如有参加2025年全国研究生统考且初试成绩过国家一区分数线的学生，请提供考研准考证及成绩单,,,商务管理学 (Managerial Business) 管理经济学 (Managerial Economics) 资讯技术管理 (Management Information System) 会计实务 (Accounting Practice) 财务管理 (Financial Management) 研究方法 (Research Methodology) 量化分析 (Quantiative Analysis) 商业传意 (Business Communication) 论文 (Thesis Wiriting) 创业与创新管理 (Entrepreneurship and Innovation Management) 营销策略 (Marketing Strategy) 投资学 (Investment) 收购与合并 (Merger and Acquisition) 人力资源策略管理 (Strategic Human Resources Management) 组织行为 (Organization Behavior) 国际商法 (Intemaional Business Law) 国际营销管理 (Intemational Marketing Management),,澳门
澳门城市大学,艺术学硕士（中文学制）,Master of Fine Arts (Chinese),"社科,艺术,创新设计学院",专业方向: 艺术 入学时间: 9月 项目时长: 2年 项目学费: 120000港币/年,往届本科毕业生需参加2025年全国硕士研究生招生考试且初试总成绩过国家A类线。 应届本科毕业生不受考研限制。,以开阔的艺术视野及先进的艺术理念带动研究生教学，培养既能植根澳门本土，又能与国际性的现代艺术发展接轨的高素质艺术人才。毕业生可以进入高等院校、博物馆、美术馆、艺术研究机构、设计公司、动画公司、游戏公司等从事研究或创作工作。,,中国美术史 (History of Chinese Art) 中国文化与艺术 (Chinese Culture and Art) 中国画创作研究 (Research on Creation of Chinese Painting) 中国书法篆刻创作研究 (Research on Creation of Chinese Calligraphy and Seal Cutting) 艺术教育心理学 (Psychology of Art Education) 西方美术史 (History of Western Art) 中西方文化比较 (Comparative Studies of Chinese and Western Cultures) 艺术专业英语 (English for Art Profession) 视觉文化专题 (Visual Culture Seminar Series) 中国古代书法研究 (Research of Ancient Chinese Calligraphy) 中国画造型艺术研究 (Research of Chinese Painting Formative Arts) 艺术创作方法研究 (Research on Artistic Creation Methods),,澳门
澳门大学,中国历史文化文学硕士,MA Chinese History and Culture,"社科,历史,人文学院",专业方向: 历史 入学时间: 8月 项目时长: 2年 项目学费: 87000澳门币/年,持有澳门大学认可的学士学位或同等学历。申请人也可能被要求具备其他知识或专业经验。申请人必须在学士学位学习中达到相当于C级或更高的总成绩 需要历史、文学、地理、教育、传播学、社会学、中文或其它相关专业的学士学位。中文授课，不强制要求提交语言,本课程旨在服务本澳中小学教师，通过集中授课、课堂互动、创新性报告等，以达到更新其中国历史与文化的知识，提升其析赏、讲解中华文明成就的能力，促使其更好地自学或讲授中国历史文化，从而加强澳门青少年对中华文明的热爱与认同。,,"中国历史文化导论 (Introduction of Chinese History and Culture) 国学经典专题研习 (Seminar on Chinese Classics) 中国古代思想 (Ancient Chinese Intellectual History) 传统中国的精神文明与非物质文明 (The Intangible and Spiritual Civilization of Traditional China) 中国历史上的重大变迁 (The Major Transformations in Chinese History) 中国文学与文化的现代变迁 (Chinese Literature and Culture in Modern Transition) 中国历史中的澳门 (Macao in Chinese History) 教学专题课：中国历史、文化和汉语的教案设计 (Pedagogical Seminar: Curricular Design on Teaching Chinese History , Culture and Language) 汉语语言文化专题 (Topics in Chinese Language) 文艺作品中的中国历史 (Chinese History Reflected by Arts and Literature) 项目报告 (Project Report)",,澳门
澳门科技大学,金融犯罪与监管硕士,Master of Financial Crime and Regulation,"社科,法律,法学院",专业方向: 法律 入学时间: 9月 项目时长: 2年 项目学费: 120000港币/年,具有法学、经济学及管理学专业的本科毕业生；具有其他专业本科毕业生并具有法律、金融从业经验或资格之人士,金融法以金融法基本理论问题及前沿和热点问题作为研究对象，在学习金融法基本理论的基础上分别讨论各个金融前沿课题的背景、研究现状和未来发展趋势，使学生在掌握一定的金融法知识基础后，能够跟踪当代的金融法理论发展，使之更好的指导未来的金融法律实践。本课程主要研究金融法基本理论，掌握主要国家及法域的金融体制、金融立法及发展趋势，学习掌握银行法律制度及货币法律制度。,,金融法 (FINANCIAL LAW) 金融刑法 (FINANCIAL CRIMINAL LAW) 反洗钱与金融犯罪 (FINANCIAL CRIMES AND ANTI-MONEY LAUNDERING) 金融监管与合规管理 (FINANCIAL REGULATION AND COMPLIANCE MANAGEMENT) 国际犯罪与跨国犯罪专题 (SPECIAL TOPICS IN INTERNATIONAL AND TRANSNATIONAL CRIMES),,澳门
澳门大学,法学（葡文）法学硕士,LLM Juridical Sciences (Portuguese),"社科,法律,法学院",专业方向: 法律 入学时间: 8月 项目时长: 2年 项目学费: 87000澳门币/年,持有澳门大学认可的学士学位或同等学历。申请人也可能被要求具备其他知识或专业经验。申请人必须在学士学位学习中达到相当于C级或更高的总成绩,澳大法学院从1995年起开设葡文法学硕士课程。课程目的是培养能从事法学教学和研究的法律人才，从地区及国际性角度促进澳门的法律研究和法制发展。,,民法 I (Civil Law I) 民事诉讼法 I (Civil Procedural Law I) 商法 I (Commercial Law I) 刑法与刑事诉讼法 I (Criminal Law and Criminal Procedural Law I) 项目报告 (Project Report) 民法 II (Civil Law II) 民事诉讼法 II (Civil Procedural Law II) 商法 II (Commercial Law II) 刑法与刑事诉讼法 II (Criminal Law and Criminal Procedural Law II) 中国私法 (Chinese Private Law) 国际私法 (Private International Law) 法律文化史 (History of Legal Cultures) 卫生法 (Health Law),,澳门
澳门大学,计算机科学理学硕士,MSc Computer Science,"工科,计算机,科技学院",专业方向: 计算机 入学时间: 8月 项目时长: 2年 项目学费: 87000澳门币/年,申请者必须具有学士学位或经澳门大学认可的同等学历，也可能被要求具有其他知识或专业经验 申请者学士学位毕业总平均分应该达到C或以上成绩（相当于GPA2.3/4，GPA14/20，GPA70/100）,应用计算和数学知识解决计算机科学学科中复杂计算问题的能力。将计算专业知识和适用于计算专业的领域知识应用于计算模型的抽象和概念化的能力。分析问题，识别和定义适合其解决方案的计算要求的能力。设计，实现和评估基于计算机的系统，过程，组件或程序，以满足公众健康与安全，社会和环境方面的适当考虑，从而满足所需需求的能力。在团队中有效运作以实现共同目标的能力。对专业，道德，法律，安全和社会问题及责任的理解。与众多受众进行有效沟通的能力。分析计算对个人，组织和社会的本地和全球影响的能力。认识到持续职业发展的必要性和能力。在了解限制的情况下使用计算实践所需的当前技术，技能和工具的能力。,,计算机科学研讨会 (Computer Science Seminar) 学术/应用论文 (Academic/Applied Thesis) 软件工程基础 (Fundamentals of Software Engineering) 计算机通信与网络 (Computer Communications and Networks) 数据库的发展现状 (Current Development in Database) 编译器构造 (Compiler Construction) 算法设计与分析 (Design and Analysis of Algorithms) 复杂性理论 (Complexity Theory) 软件工程中的形式化方法 (Formal Methods in Software Engineering) 离散系统仿真 (Discrete System Simulation) 计算机系统性能建模 (Computer System Performance Modeling) 计算机图形学原理和系统 (Computer Graphics - Principles and Systems) 人工智能原理 (Principles of Artificial Intelligence),,澳门
澳门城市大学,应用语言学文学硕士,MA Applied Linguistics,"社科,语言,人文社会科学学院",专业方向: 语言 入学时间: 9月 项目时长: 2年 项目学费: 100000港币/年,往届本科毕业生需参加2025年全国硕士研究生招生考试且初试总成绩过国家A类线。 应届本科毕业生不受考研限制。,应用语言学硕士学位课程是一个学制为两年的硕士学位课程。课程目標为培养应用语言学方面的高素质专业人才，课程在学生本科的相关学习基础上，拓展和增强他们语言，文化，教育，沟通方面的专业知识和技能，以培养他们成为具有中国情怀，国际视野，专业技能及社会责任感的英语及汉语教育行业的优秀人才。,,"研究方法 (Research Method) 应用语言学概论 (Introduction to Applied Linguistics) TESOL方法、教学法和技术 (TESOL  Methods, Teaching Methods and Techniques) 课程和材料：设计和评估 (Curriculum and Materials: Design and Evaluation) 二语学习与习得 (Second Language Learning and Acquisition) 英语教学测试 (English Teaching Test) 对外汉语教学法 (Teaching Method of Teaching Chinese as a Foreign Language) 词汇与语法：理论及实践 (Vocabulary and Grammar: Theory and Practice) 中国文化及经典导论 (Introduction to Chinese Culture and Classics) 中文教学实践 (Chinese Teaching Practice) 跨文化沟通概论 (Introduction to Cross-Cultural Communication) 职场环境中的跨文化交流 (Cross-Cultural Communication in the Workplace Environment) 职场跨文化沟通管理 (Workplace Cross-Cultural Communication Management) 语言、话语和身份 (Language, Discourse and Identity) 儿童语言教学：方法、教学法及技术 (Language Teaching for Children: Methods, Teaching Methods and Techniques)",,澳门
澳门大学,数据科学（智慧政务）理学硕士,MSc Data Science (Smart Governance),"理科,数据科学,社会科学学院",专业方向: 数据科学 入学时间: 8月 项目时长: 2年 项目学费: 87000澳门币/年,申请人须持有学士学位，并符合澳门大学有关硕士学位课程的入学要求。 申请者为中国大陆地区毕业者，须持有教育部认可的大学颁发的学士学位。本科GPA 2.8(75满分100分)或以上。优先录取211、985类高校毕业生。计算机科学、社会科学或数学相关专业背景优先考虑,该计划的特色是多学科课程，该课程汲取了跨学科的见解，使学生能够使用最新的工具和分析方法从现实世界的数据集中提取信息，并以各种方式解释和交流其发现改变人们的思想和行为。数据科学理学硕士课程为期两年，与不同学术单位合作开展。科学与技术学院总共将开设4门基础课程，内容涉及大数据理论，挖掘和分析技术等。要求学生声明自己的专业，这是由不同学术单位提供的，以学习和研究如何处理大数据。切实有效地应用于他们指定的专业领域。学生应根据指定专业的学习计划注册课程，并完成具有指定主题的项目报告。,,数据科学编程导论 (Introduction to Data Science Programming) 数据科学与数据可视化 (Data Science and Data Visualization) 数据库与数据挖掘技术 (Database and Data Mining Technologies) 机器学习工具 (Tools for Machine Learning) 项目报告 (Project Report) 公民数据采集与分析 (Civic Data Acquisition and Analysis) 大数据与智能治理 (Big Data and Smart Governance) 媒体与舆论数据分析 (Analysis of Media and Opinion Data) 理解智能治理 (Making Sense of Smart Governance) 基于大数据的定量社会科学研究 (Quantitative Social Science Research with Big Data),,澳门
澳门理工大学,大数据与物联网理学硕士,MSc Big Data and Internet of Things,"工科,计算机,应用科学学院",专业方向: 计算机 入学时间: 8月 项目时长: 2年 项目学费: 85000澳门币/年,具有电脑学或相关领域的学士学位或同等学历；或 正修读上述学历课程最后一年。 内地往届学士毕业生须提交应届内地全国研究生招生考试初试成绩，且达国家一区分数线或以上,本课程旨在培养大数据与物联网有深入了解的专才，能配合智慧城市的建设工作，课程着重启发学生研发物联网技术的核心系统架构、通信机制与创新应用，以领先的技术进行大数据处理，有效运用与智能城市应用相关的信息，开展物联网与大数据方面的研究。,,物联网概论 (Introduction to Internet of Things) 大数据概论 (Introduction to Big Data) 研究方法 (Research Methodology) 物联网通信技术 (Communication Technology For Internet of Things) 物联网多媒体技术 (Multimedia Technology For Internet of Things) 大数据电子商贸 (E-Commerce With Big Data) 机器学习 (Machine Learning) 安全和认证 (Security and Authentication) 云计算 (Cloud Computing) 数字媒体和社交网络 (Digital Media and Social Networking) 特选论题 I (Selected Topics I) 特选论题 II (Selected Topics II)  论文 (Dissertation),,澳门
