ID,中文名称,英文名称,标签,所属院校,专业方向,入学时间,项目时长,项目学费,项目规模,就业比例,面试形式,培养目标,申请要求,语言要求,顾问解析,课程设置,申请时间,项目链接,项目官网,排名,学校类型,是否STEM
72570,欧洲公共政策文学硕士,MA in European Public Policy,"社科, 公共政策与事务",约翰霍普金斯大学,公共政策与事务,夏季,一年,"31,530英镑",无,无,无,无,本科学位。,无,无,无,无,https://www.compassedu.hk/majr_72570,无,,"社科, 公共政策与事务, 美国大学协会, 十大联盟",否
73079,金融科技和分析,MS in  Financial Technology and Analytics,"商科, 金融",斯蒂文斯理工学院,金融,STEM,秋季,未标明,无,无,无,无,暂无,无,无,无,无,https://www.compassedu.hk/majr_73079,无,,"商科, 金融, 美国独立理工大学协会, 美国国家一级大学",是
73578,生物医学科学硕士,MS in Biomedical Sciences,"社科, 医学",范德堡大学,医学,STEM,秋季,1年,无,无,无,无,申请人应已完成学士学位，最低 GPA 为 3.2。,无,无,无,无,https://www.compassedu.hk/majr_73578,无,,"社科, 医学, 新常春藤, 美国大学协会",是
73910,系统工程理学硕士,MS in Systems Engineering,"工科, 其他工科",马里兰大学帕克分校,其他工科,STEM,秋季/春季,30学分,无,无,无,无,GPA 3.0; 毕业于工程、科学或数学专业 （学习过两个学期的微积分物理，三个学期的微积分（包括多变量微积分），微分方程课程，以及熟悉至少一种编程语言还建议学习一个学期的工程统计学和线性代数）；需要了解影响开发复杂系统和服务的财务和管理问题,无,无,无,无,https://www.compassedu.hk/majr_73910,无,,"工科, 其他工科, 公立常春藤, 大十联盟, 大西洋海岸联盟, Universitas 21",是
72764,工业和系统工程理学硕士,MS in Industrial and Systems Engineering,"工科, 工业工程",佛罗里达大学,工业工程,STEM,秋季/春季,24学分,无,无,无,无,GPA达到3.0或以上。本科阶段学过微积分，概率和统计，矩阵法，编程。,无,无,无,无,https://www.compassedu.hk/majr_72764,无,,"工科, 工业工程, 公立常春藤, 美国大学协会",是
73120,公共管理文学硕士,MA in Public Management,"社科, 公共政策与事务",约翰霍普金斯大学,公共政策与事务,春季/夏季/秋季,12门课程,4405美元/课程,无,无,无,无,无,无,<p>JHU的公共管理硕士开设在文理学院的AAP项目下，在华盛顿特区授课。要求完成12门共计36学分的课程，6门必修+6门选修。如果学生对数据分析感兴趣，还可以额外选择学习一个certificate in data analytics and policy。课程要求有12门课，时长为1-2年。该计划可以选择三个concentration 之一来进行专业化：公共行政和领导，公共政策评估，公共财政管理和预算。</p><p>其毕业生活跃于公共服务相关领域，就业单位有白宫，财政部，国防部，健康与人类服务部，国土安全部，美国联邦应急管理署等。就业方向主要是政府政策制定或顾问，非营利组织，公共关系，人力资源管理，企业管理，军事，咨询等。</p><p> </p><p>申请要求大学毕业有管理学或相关专业的学士学位，GPA3.0+，雅思7+，托福100+。</p>,无,无,https://www.compassedu.hk/majr_73120,无,,"社科, 公共政策与事务, 美国大学协会, 十大联盟",否
73586,获取失败,获取失败,,,,,,,,,,,,,,,,https://www.compassedu.hk/majr_73586,无,,,否
73078,金融理学硕士,MS in Finance,"商科, 金融",斯蒂文斯理工学院,金融,STEM,春季/夏季/秋季,2年,无,无,无,无,暂无,无,无,无,无,https://www.compassedu.hk/majr_73078,无,,"商科, 金融, 美国独立理工大学协会, 美国国家一级大学",是
72951,金融工程理学硕士,MS in Financial Engineering,"商科, 金工金数",里海大学,金工金数,STEM,秋季/春季,2年,无,无,无,无,需要学过：数据分析、线性代数、统计学和微积分等课程。GPA较高者可考虑免GRE(大于3.3且先修课等级均大于B）,无,无,无,无,https://www.compassedu.hk/majr_72951,无,,"商科, 金工金数, 爱国者联盟",是
72769,房地产理学硕士,MS in Real Estate,"商科, 房地产",佛罗里达大学,房地产,STEM,夏季,10个月,无,无,无,无,GPA3.2及以上，最好有工作经验（包括暑期实习）,无,无,无,无,https://www.compassedu.hk/majr_72769,无,,"商科, 房地产, 公立常春藤, 美国大学协会",是
65659,国际事务硕士,Master of Arts in International Affairs,"社科, 公共政策与事务",约翰霍普金斯大学,公共政策与事务,春季/秋季,2年,41984欧元,无,无,无,无,学习过宏微观经济学和微积分等相关课程,无,"<p>约翰霍普金斯大学国际事务硕士Master of Arts in International Affairs（MAIA）隶属于高级国际研究院SAIS，但上课地点在SAIS欧洲校区（也就是Bologna校区），可以选择2年都在SAIS European，或者一年在SAIS欧洲校区，一年在合作大学。项目偏研究导向，有毕业论文要求。</p><p>

录取方面：Size非常小，就业去向主要也是在欧洲当地（92%），这对学生本身的语言能力也是很高的要求。</p>",无,无,https://www.compassedu.hk/majr_65659,无,,"社科, 公共政策与事务, 美国大学协会, 十大联盟",否
65690,计算金融与风险管理硕士,MS in Computational Finance and Risk Management,"商科, 金工金数",华盛顿大学,金工金数,STEM,秋季,42学分,无,无,无,无,"微积分,概率论与统计,一种编程语言,如Java、c++、Python,或一种数学或统计编程语言,如MATLAB、R/S-PLUS",无,"<p>华盛顿大学UW-Seattle 计算金融和风险管理Computational Finance and Risk Management（MS-CFRM）在最新2021Quantnet上排名14th。</p><p>

课程设置：项目隶属于数学系，共15个月，旨在应用高等数学、统计等数理工具解决计量金融领域的实际问题，虽然名字叫Risk Management，但课程来说导向性没有很明显。锦上添花的是公立的学费便宜。</p><p>

就业方面：最新的6个月内的就业率在100%（3个月是96%），因为项目规模size不大，最近2届38ft/42ft，就业服务还是可以满足学生的需求，项目也会做 resume book，给主要的业界公司，也会帮助学生network。需要注意的是，因为西雅图地理位置的关系，当地有很多互联网公司，比如Amazon、Microsoft等，所以也不可避免的很多学生会转行做DA。</p><p>

录取方面：录取会有面试，general向，非tech面。</p>",无,无,https://www.compassedu.hk/majr_65690,无,,"商科, 金工金数, 公立常春藤, 帕克十二联盟, 环太平洋大学联盟, 国际大学气候联盟",是
74077,获取失败,获取失败,,,,,,,,,,,,,,,,https://www.compassedu.hk/majr_74077,无,,,否
65752,数据科学硕士,Master of Data Science,"理科, 数据科学",莱斯大学,数据科学,秋季,31学分,2861美元/学分,无,无,无,无,无,无,"<p>Rice大学也于21fall新开了一个MDS项目，隶属于数据科学研究院，授课式，就业导向的跨学科项目，侧重DS在各个领域的应用。</p><p>

课程设置：提供3个方向，商业分析BA, 机器学习ML，和图像处理 image processing，也有capstone。</p><p>

录取方面：因为项目主要依托于Rice CS的师资（RICE CS非常强），所以预测难度不会太低。</p>",无,无,https://www.compassedu.hk/majr_65752,无,,"理科, 数据科学, 新常春藤, 美国大学协会",是
72740,工商管理硕士,Master of Business Administration,"商科, 工商管理",纽约大学,工商管理,秋季,两年,"82,326 美元",无,无,无,无,申请者必须持有地区认可机构的学士学位且GPA达到3.0及以上,无,无,无,无,https://www.compassedu.hk/majr_72740,无,,"商科, 工商管理, 美国大学协会, 高潜力人才签证计划",否
72763,计算机科学理学硕士,MS in Computer Science,"工科, 计算机",维克森林大学,计算机,STEM,秋季/春季,30-36学分,无,无,无,无,"申请者应会使用高级语言（如 Java、C 或 C++）进行编程
基本的计算机组织和体系结构
数据结构和算法
操作系统和网络原理；此外还应该完成相当于以下内容的数学课程：两个学期的微积分（微积分和积分包括无穷级数）
离散数学
线性代数
概率和统计。",无,无,无,无,https://www.compassedu.hk/majr_72763,无,,"工科, 计算机, 大西洋海岸联盟",是
65658,国际经济与金融文学硕士,Master of Arts in International Economics and Finance,"社科, 公共政策与事务",约翰霍普金斯大学,公共政策与事务,STEM,夏季/秋季,11个月,无,无,无,无,"GPA至少3.0,先修课建议：中级经济学（微观经济学和宏观经济学）课程和至少一门高级经济学课程 ; 最好是计量经济学。有扎实的定量课程的学术背景,包括微积分统计和/或计量经济学的课程。",无,"<p>课程设置：项目开设在高级国际研究学院SAIS下，SAIS是全美数一数二的国际关系学院，与哈佛的肯尼迪政府学院齐名，而且地处华盛顿特区，占尽地利人和。作为SAIS学院的王牌硕士项目之一，侧重国际经济和金融环境下的经济政策解读，旨在让学生更深层次的理解经济理论，掌握专业的计量经济学方法去分析政策制定，经济发展等国际经济议题。</p><p> </p><p>项目开设于2014年，时长仅10个月，但有56学分14门课，加一个时下热点国际经济金融政策议题的capstone，课程非常紧凑，还有2个skills workshop让学生掌握一些定量分析软件EViews，MATLAB，PcGive，R，Stata。</p><p> </p><p>就业方面：凭借JHU的国际排名，以及SAIS在美国超高的reputation，项目就业质量很好，就业率在94%，留美率71%，就业方向主要在私营机构和企业，包括金融机构、咨询公司、互联网企业，如德勤、中信证券, 全球领先的公共及商业市场咨询服务提供方Guidehouse等，也有部分在国际组织或多边机构, 如国际货币基金组织、世界银行、联合国等。</p><p> </p><p>录取方面：MIEF始终是小班教学，Size100人左右，托福中位数在107-111之间，GPA中位数在3.51-3.81,入读学生平均具有1年全职工作经验，主申MPP方向或经济方向的申请者均可考虑，建议有国际经济政策相关的研究经历，或者相关国际组织，智库等的实习经历。</p>",无,无,https://www.compassedu.hk/majr_65658,无,,"社科, 公共政策与事务, 美国大学协会, 十大联盟",是
73081,机器人工程硕士,MEng in Robotics,"工科, 计算机",斯蒂文斯理工学院,计算机,STEM,春季/夏季/秋季,未标明,无,无,无,无,GPA3.0,无,无,无,无,https://www.compassedu.hk/majr_73081,无,,"工科, 计算机, 美国独立理工大学协会, 美国国家一级大学",是
67226,统计学硕士,Professional Master's in Statistics,"理科, 数学",莱斯大学,数学,STEM,秋季,1.5年,无,无,无,无,"单变量和多变量微积分
线性或矩阵代数
概率和统计（基于微积分）
具备高级编程语言的知识,例如 C/C++/C#、JAVA、Fortran、Matlab、R/S+、Python 等。",无,"<p>莱斯大学统计硕士Professional Master's in Statistics (MStat)隶属于工程学院下的统计系， 时长1年半。</p><p>

课程设置： 5门必修课，选修课主要分6个options（MBA joint那个忽略）。学生可以根据自己的兴趣和职业规划进行选择。这个specialization 就是可以修更多理论导向的课程（register for classes of a more theoretical nature）
其他track 还有：Applied Statistics for Industry（应用统计），Financial Statistics and the Statistics of Risk金融统计与风险统计，Bioinformatics, Statistical Genetics, and Biostatistics生物统计，Statistical Computing and Data Mining统计计算和数据挖掘, Environmental Statistics环境统计。</p><p>

就业方面：项目名就是professional，培养目标也是professional statisticians career preparation ,整体是就业导向的。但在项目下设的不同的course options里有一个preparation for PhD studies in statistics，mathematical economics and finance 的选择，所以也是读博友好的。</p><p>

录取方面：录取有先修课要求，但可以在rice 的summer 修。</p>",无,无,https://www.compassedu.hk/majr_67226,无,,"理科, 数学, 新常春藤, 美国大学协会",是
72813,工商管理硕士,Master of Business Administration,"商科, 工商管理",德克萨斯大学奥斯汀分校,工商管理,STEM,秋季,2年,无,无,无,无,无具体要求。,无,无,无,无,https://www.compassedu.hk/majr_72813,无,,"商科, 工商管理, 公立常春藤, 美国大学协会",是
72947,计算机工程工学硕士,MEng in Computer Engineering,"工科, 计算机",里海大学,计算机,STEM,秋季/春季,30学分,无,无,无,无,计算机课程及工程相关专业，具备一定编码基础,无,<p>里海大学Lehigh University的计算机工程工学硕士MEng in Computer Engineering是一个专业学位项目，旨在提供深入的计算机工程知识和技能，以满足高科技行业的专业需求。该项目强调理论与实践相结合，学生可以选择不同的专业方向，如人工智能、机器学习、人机交互、系统等。</p><p>课程设置：</p><p>MEng in Computer Engineering项目要求学生完成至少30学分的课程，其中包括以设计为导向的课程和工程项目。学生需要进行项目的口头陈述，并按照研究生院的规定提交研究计划。课程设置灵活，允许学生根据自己的兴趣和职业目标选择课程，同时提供了包括电路与系统、计算机架构与网络、信号处理等多个研究方向。</p><p>就业方面：</p><p>里海大学计算机工程专业的毕业生就业前景广阔，毕业生收入在全美排名Top 25。学生毕业后在教授职位、技术公司、以及在MIT等研究机构做博士后的都有。此外，学校提供了丰富的实习机会和就业资源，帮助学生顺利过渡到职场。</p><p>录取方面：</p><p>申请里海大学MEng in Computer Engineering项目，学生需要具备计算机科学或相关领域的学士学位。项目对申请者的数学背景有一定要求，建议学生在线性代数、复变函数和高等微积分等领域有一定的课程学习。语言成绩要求为TOEFL至少79分（其中听力15分、阅读20分、口语20分、写作20分），或IELTS总分6.5分（阅读6.5分、听力6.0分、口语6.5分、写作6.0分）。</p>,无,无,https://www.compassedu.hk/majr_72947,无,,"工科, 计算机, 爱国者联盟",是
65660,国际关系硕士,Master of Arts in International Relations (MAIR),"社科, 公共政策与事务",约翰霍普金斯大学,公共政策与事务,秋季,2年,53900美元/年,无,无,真人单面,无,学习过宏微观经济学和微积分等相关课程,无,"<p>课程设置：约翰霍普金斯大学国际关系硕士Master of Arts in International Relations（MAIR）隶属于高级国际研究院SAIS，是顶尖国关学院，项目2年制，可以选择2年都在DC, 也可以选择一年在DC，一年在sais欧洲校区（意大利）学习。</p><p> </p><p>第一年着重培养学生的经济学和量化分析方法的训练（6门核心课），第二年则可以选择两个细分方向（从functional和regional 2个维度选择）进行深耕。除了专业课程之外，项目也非常培养学生的职业能力，尤其是从业需要的演讲/写作课程和量化分析工具课程。</p><p> </p><p>就业方面：因为SAIS地处DC，享有首都天然的政治氛围和国关资源，所以地理位置优势明显，实习机会也很多，再加上SAIS的校友网遍布政府机构和各大知名国际组织，项目就业率非常高86%。但是因为国际关系专业属性的问题，中国学生回国的也挺多的。</p><p> </p><p>录取方面：项目规模挺大的（300不到），国际生比例还不错36%，GRE/GMAT是optional。</p>",无,无,https://www.compassedu.hk/majr_65660,无,,"社科, 公共政策与事务, 美国大学协会, 十大联盟",否
73585,计算与应用数学专业硕士,Professional Master's of Computational and Applied Mathematics,"理科, 数学",莱斯大学,数学,STEM,秋季,1.5-2年,无,无,无,无,MCAAM 项目的录取对象是持有工程、数学或物理、生物或数学科学学士学位（或同等学历）的学生。,无,无,无,无,https://www.compassedu.hk/majr_73585,无,,"理科, 数学, 新常春藤, 美国大学协会",是
73708,运输管理理学硕士,MS in Transportation Management,"工科, 交通运输",纽约大学,交通运输,STEM,春季/秋季,30学分,无,无,无,无,"申请者需要持有相对应的学士学位,GPA 达到3.0以上申请者需要学习至少两年的大学数学或者是统计学课程",无,无,无,无,https://www.compassedu.hk/majr_73708,无,,"工科, 交通运输, 美国大学协会, 高潜力人才签证计划",是
72050,计算机科学理学硕士,MS in Computer Science,"工科, 计算机",斯蒂文斯理工学院,计算机,春季/秋季,36学分,18707美元/学期,无,无,无,无,GPA至少 3.0,无,<p>斯蒂文斯理工学院的计算机科学硕士（MS）项目致力于培养能够满足信息技术发展和应用领域日益增长的专业人才需求。本项目旨在让学生深入理解前沿的计算机科学概念，并掌握使用合适的编程语言解决复杂计算机问题的能力。课程内容广泛，覆盖了云计算与数据库、软件开发、视觉计算与信息提取、安全系统、机器学习、Web应用开发、游戏与模拟、移动通信系统、建模、仿真与可视化、网络及系统管理等多个关键领域。</p><p>对于计算机科学背景的学生，项目要求完成30个学分，而对于非计算机科学背景的学生，提供了36个学分的选项，这为希望转向计算机科学领域的学生提供了一个理想的转型途径。</p><p>值得一提的是，本项目的毕业生就业率高达99%，这一数据充分证明了其教育质量和学生的市场竞争力。</p>,无,无,https://www.compassedu.hk/majr_72050,无,,"工科, 计算机, 美国独立理工大学协会, 美国国家一级大学",是
72949,计算机科学工学硕士,MEng in Computer Science,"工科, 计算机",里海大学,计算机,STEM,秋季/春季,30学分,无,无,无,无,计算机相关专业本科,无,无,无,无,https://www.compassedu.hk/majr_72949,无,,"工科, 计算机, 爱国者联盟",是
71715,生物统计学硕士,Masters of Science (MS) in Biostatistics,"理科, 数学",范德堡大学,数学,秋季,2年,2150美元/学分,无,无,无,无,3个学期的微积分(多元微积分)；1个学期的线性代数；统计,无,"<p>课程设置：范德堡大学生物统计系隶属于school of medicine，顺应大数据的时代发展，范德堡大学生物统计系致力于go beyond传统的统计建模和推理,运用data science /statistical learning来分析大量的结构化和非结构化数据,并找出模式, 从而实现精准医疗。生物统计MS硕士，为期2年，8节课，包括一个贯穿第二年的Thesis Research。</p><p>
录取方面：每年收到60个MS的申请，每年录取4个. 申请者专业背景不限，但需要满足先修课要求：3个学期的微积分(通过多元变量)；1个学期的线性代数；1个学期的统计；熟悉数学reasoning。prefer接触过统计编程(如R, STATA, SAS, SPSS)或编程(如JAVA)                                                                                                   录取方面：2个项目都很看重学生的量化背景 (mathematics, statistics, computer science, biomedical engineering or a closely related field).</p>",无,无,https://www.compassedu.hk/majr_71715,无,,"理科, 数学, 新常春藤, 美国大学协会",是
72577,房地产和基础设施硕士,MS in Real Estate and Infrastructure,"商科, 房地产",约翰霍普金斯大学,房地产,STEM,秋季,一年,无,无,机面（kira）,无,无,无,<p>JHU的房地产与基础设施（MSREI）项目是美国为数不多的专注于房地产与基础设施的硕士学位项目之一。项目由JHU Carey商学院提供，时长1年（30学分），旨在培养具备深厚专业知识和实际操作技能的房地产专业人士，以应对行业不断变化和日益多元化的需求。</p><p>MSREI课程涵盖广泛领域，包括投资、开发、金融、建筑与设计、创业、城市规划与可持续性、资本市场和房地产法等。通过这些课程，学生能够从交易达成到项目管理等多个方面提升自己的技能和知识。此外，学院为MSREI项目投入了大量资源，并引入了多家合作企业。学生有机会参与这些企业主导的房地产项目，并进行实地考察和案例学习。毕业生的就业方向主要集中在房地产金融领域。</p><p>虽然在Carey商学院的众多硕士项目中，MSREI的竞争相对没有MSF和BARM等热门项目那么激烈，但由于项目规模较小，申请难度也不算低。申请者的平均GRE成绩为335，平均GPA为3.26。建议申请者具备房地产相关课程背景或实习经验。</p>,无,无,https://www.compassedu.hk/majr_72577,无,,"商科, 房地产, 美国大学协会, 十大联盟",是
74084,网络安全,MS in Cybersecurity,"工科, 计算机",斯蒂文斯理工学院,计算机,STEM,秋季/春季/夏季,30学分,无,无,无,无,本科为相关专业背景，GPA达到3.0以上,无,无,无,无,https://www.compassedu.hk/majr_74084,无,,"工科, 计算机, 美国独立理工大学协会, 美国国家一级大学",是
72749,获取失败,获取失败,,,,,,,,,,,,,,,,https://www.compassedu.hk/majr_72749,无,,,否
72948,计算机工程理学硕士,MS in Computer Engineering,"工科, 计算机",里海大学,计算机,STEM,秋季/春季,30学分,无,无,无,无,计算机课程及工程相关专业，具备一定编码和工程技能基础,无,<p>里海大学（Lehigh University）的计算机工程理学硕士（MS in Computer Engineering）是一个以实践和理论相结合的STEM项目，旨在培养学生在计算机工程领域的高级知识和技能。该项目提供了一系列专业方向，包括数据库和信息系统、互联网搜索、图形学、用户界面和基于网络的系统等，允许学生根据自己的兴趣和职业规划选择相应的研究领域。</p><p> </p><p>课程设置：</p><p>计算机工程理学硕士课程要求学生完成至少30学分，其中包括一系列必修课程和选修课程。学生可以选择14个不同的领域进行深入学习，这些领域涵盖了从计算机系统和网络到图形和人机交互的广泛主题。课程设置强调创新和研究，鼓励学生参与前沿技术的研究项目。</p><p> </p><p>就业方面：</p><p>里海大学计算机工程理学硕士的毕业生在就业市场上具有竞争力，能够进入多个行业工作，包括但不限于信息技术、国防、通信、医疗设备和金融服务等。该项目的研究领域和课程内容与当前工业需求紧密结合，确保了毕业生的就业前景。</p><p> </p><p>录取方面：</p><p>申请该项目，学生需要具备计算机课程及工程相关专业背景，以及一定的编码和工程技能基础。语言要求包括TOEFL至少79分（写作20分、口语20分、阅读20分、听力15分）或IELTS至少6.5分（写作6.0分、口语6.5分、阅读6.5分、听力6.0分）。此外，申请者需要提交GRE成绩。</p>,无,无,https://www.compassedu.hk/majr_72948,无,,"工科, 计算机, 爱国者联盟",是
73545,获取失败,获取失败,,,,,,,,,,,,,,,,https://www.compassedu.hk/majr_73545,无,,,否
73711,公共健康政策与管理硕士,MPA in Health Policy and Management,"社科, 公共卫生",纽约大学,公共卫生,春季/秋季,2年,"46,777美元",无,无,无,无,"建议申请者提前提交申请,因为全年的录取竞争激烈可能需要提交一分钟视频,上传视频链接",无,无,无,无,https://www.compassedu.hk/majr_73711,无,,"社科, 公共卫生, 美国大学协会, 高潜力人才签证计划",否
73582,风险、可靠性和恢复工程硕士,"MEng in Risk, Reliability, and Resilience Engineering","工科, 其他工科",范德堡大学,其他工科,STEM,秋季/春季,1年,无,无,无,无,入学学生通常需要拥有工程、数学或物理科学的学士学位。,无,无,无,无,https://www.compassedu.hk/majr_73582,无,,"工科, 其他工科, 新常春藤, 美国大学协会",是
73080,机器学习,MS in Machine Learning,"工科, 计算机",斯蒂文斯理工学院,计算机,STEM,春季/夏季/秋季,未标明,无,无,无,无,GPA3.0,无,无,无,无,https://www.compassedu.hk/majr_73080,无,,"工科, 计算机, 美国独立理工大学协会, 美国国家一级大学",是
73896,人机交互与设计硕士,Master of Human-Computer Interaction and Design,"工科, 计算机",华盛顿大学,计算机,STEM,秋季,1年,无,无,无,无,GPA3.0；四年制学士学位,无,无,无,无,https://www.compassedu.hk/majr_73896,无,,"工科, 计算机, 公立常春藤, 帕克十二联盟, 环太平洋大学联盟, 国际大学气候联盟",是
