ID,中文名称,英文名称,标签,所属院校,专业方向,入学时间,项目时长,项目学费,项目规模,就业比例,面试形式,培养目标,申请要求,语言要求,顾问解析,课程设置,申请时间,项目链接,项目官网,排名,学校类型,是否STEM
72871,获取失败,获取失败,,,,,,,,,,,,,,,,https://www.compassedu.hk/majr_72871,无,,,否
73533,环境健康科学硕士,MPH in Envioromental Health Science (EHS),"社科, 公共卫生",耶鲁大学,公共卫生,秋季,2年,"51,895美元/年",无,无,无,无,申请人必须具备文学学士或理学学士学位或外国同等学历,无,无,无,无,https://www.compassedu.hk/majr_73533,无,,"社科, 公共卫生, 常春藤联盟, 美国大学协会, 全球大学校长论坛",否
71826,机械工程工学硕士,M.Eng. in Mechanical Engineering,"工科, 机械工程",加州大学伯克利分校,机械工程,秋季,1年,68000美元/年,无,无,无,无,无,无,"<p>加州大学伯克利分校工程学院机械工程系硕士项目分为MS和ME两种，开设的专业方向有：先进能源技术、体验式高级控制系统设计、物理过程与系统仿真、建模、产品设计。一般来说，硕士项目分带毕业论文和不带毕业论文两种：带毕业论文项目要求修读20个学分，不带毕业论文项目需修读24个学分，每年接受的申请大概1,000份，仅开放150个名额，录取门槛高。
工科的申请中，UC系统中的学校Berkeley和UCLA均是具有相当大的申请难度的学校，就Berkeley来说，成功的申请者的GRE成绩多数都高于90%，TOEFL要求：90分最低，建议最少100，IELTS要求：7.0，需要提供GRE且数学大于90%。</p>",无,无,https://www.compassedu.hk/majr_71826,无,,"工科, 机械工程, 公立常春藤, 美国大学协会",是
71759,生物工程理学硕士,MS in Bioengineering,"工科, 生物工程",加州大学圣地亚哥分校,生物工程,秋季,3-6quarters,10962.17美元/quarter,无,无,无,无,无,无,<p>加州大学圣地亚哥分校生物工程系研究生阶段开设有生物工程硕士（M.Eng.）：为期1年，就业导向，旨在为医疗和生物工程行业培养更多的设计与项目工程师。主要面向当今技术和专业需要提升的工程师，或对工程设计，开发，制造与管理感兴趣的学生。不需要撰写毕业论文。生物工程硕士（MS）：旨在扩大和拓宽学生的本科背景，使毕业生具备生物工程的前沿知识。提供了thesis option，有利于学生后续继续申请/攻读博士学位。项目将课程与创新研究相结合。 </p>,无,无,https://www.compassedu.hk/majr_71759,无,,"工科, 生物工程, 环太平洋大学联盟, 国际公立大学论坛, 美国大学协会, 高潜力人才签证计划",是
74066,商业研究硕士,MS in Business Research,"商科, 其他商科",密歇根州立大学,其他商科,秋季,30学分,无,无,无,无,无,1. 具有学士学位及卓越的学习成绩；2. 在GMAT或GRE中取得优异成绩；3. 对学术研究感兴趣,无,无,无,无,https://www.compassedu.hk/majr_74066,无,,"商科, 其他商科, 公立常春藤, 十大联盟, 美国大学协会",否
71676,教育学硕士,Master's in Education,"社科, 教育",加州大学伯克利分校,教育,秋季,1年,19345.25美元/学期,无,无,无,无,本科GPA3.0以上,无,"<p>加州大学伯克利分校MA in Education时长1年，课程自由度很高，为学生提供了不同的细分方向的选择（SOP里需要写），完全可以根据自己感兴趣的研究领域和职业方向进行修课。大致包括：Critical Studies of Race, Class, and Gender； Cultural Studies of Sport in Education；Early Education Leadership；Learning and Data Science；Evaluation and Measurement。</p><p>

录取方面：每年录取25-30人左右</p>",无,无,https://www.compassedu.hk/majr_71676,无,,"社科, 教育, 公立常春藤, 美国大学协会",是
73787,系统工程理学硕士,MS in Systems Engineering,"工科, 工程管理",波士顿大学,工程管理,STEM,秋季/春季,1年,无,无,无,无,相关专业，GPA3.0以上,无,无,无,无,https://www.compassedu.hk/majr_73787,无,,"工科, 工程管理, 美国大学协会",是
73531,医疗健康管理硕士,MPH in Health Care Management,"社科, 公共卫生",耶鲁大学,公共卫生,秋季,2年,"51,895美元/年",无,无,无,无,申请人必须具备文学学士或理学学士学位或外国同等学历,无,无,无,无,https://www.compassedu.hk/majr_73531,无,,"社科, 公共卫生, 常春藤联盟, 美国大学协会, 全球大学校长论坛",是
72801,中国经济与政治事务硕士,Master of Chinese Economic and Political Affairs,"社科, 国际关系",加州大学圣地亚哥分校,国际关系,秋季,两年,"44,240.99美元",无,无,无,无,GPA3.0及以上。,无,无,无,无,https://www.compassedu.hk/majr_72801,无,,"社科, 国际关系, 环太平洋大学联盟, 国际公立大学论坛, 美国大学协会, 高潜力人才签证计划",否
73526,健康政策硕士,MPH in Health Policy,"社科, 公共卫生",耶鲁大学,公共卫生,秋季,2年,"51,895美元/年",无,无,无,无,申请人必须具备文学学士或理学学士学位或外国同等学历,无,无,无,无,https://www.compassedu.hk/majr_73526,无,,"社科, 公共卫生, 常春藤联盟, 美国大学协会, 全球大学校长论坛",是
74045,数据科学硕士,MS in Data Science,"理科, 数据科学",密歇根州立大学,数据科学,STEM,秋季,30学分,无,无,无,无,GPA最低3.0；拥有相关四年制学士学位；通过工作或其他相关经验展示足够的准备,无,无,无,无,https://www.compassedu.hk/majr_74045,无,,"理科, 数据科学, 公立常春藤, 十大联盟, 美国大学协会",是
71887,材料科学与工程工学硕士,M.Eng. in Material Science and Engineering,"工科, 材料",加州大学伯克利分校,材料,秋季,9个月,31195.25美元/学期,无,无,无,无,每学期只能申请1个项目。申请必须在截止日期当天太平洋标准时间晚上 8:59 之前提交。GPA3.0以上,无,<p>加州大学伯克利分校材料科学与工程系开设有材料科学工程硕士（M.Eng in Materials Science & Engineering）：为期9个月，以就业导向为主，是专业硕士项目。项目提供了不同的细分方面：生物材料，高级结构材料，光电材料，化学材料，材料计算等。伯克利MEng项目的特色在于：除了材料科学与工程方面的专业知识和技能，还注重培养学生的软实力，包括但不限于：领导力、市场营销、金融和管理等技能，从而培养成懂技术的管理者。项目包括了一个capstone project，学生可以获得实践经验。</p>,无,无,https://www.compassedu.hk/majr_71887,无,,"工科, 材料, 公立常春藤, 美国大学协会",是
71954,土木环境与大地测量工程理学硕士,"M.S. in Civil, Environmental, and Geodetic Engineering","工科, 环境工程",俄亥俄州立大学,环境工程,秋季,30-33学分,38376美元/年,无,无,无,无,GPA低于 3.0需提交GRE,无,无,无,无,https://www.compassedu.hk/majr_71954,无,,"工科, 环境工程, 美国大学协会, 大十联盟",是
71985,结构工程理学硕士,MS Structural Engineering,"工科, 土木工程",加州大学圣地亚哥分校,土木工程,秋季,48学分,10962.17美元/quarter,无,无,无,无,GPA 至少3.0,无,<p>加州大学圣地亚哥分校（UCSD）的工学院下设有结构工程系（Structural Engineering Department），这是全球唯一以“结构”领域为主要研究方向的大学系部。该系旨在培养跨领域的结构工程人才，不仅关注传统的土木结构，如桥梁、坝体、房屋等大型结构设备，还涵盖了更广泛的结构物体，例如3D打印的人造结构、无人机机体的设计等。</p><p>课程设置：结构工程理学硕士（M.S. in Structural Engineering）项目要求学生修满48学分方可毕业。学生可以选择两种修读方式：Comprehensive Examination（综合考试）或Thesis Plan（论文计划）。无论选择哪个方式，学生都需要从结构分析、计算力学、岩土工程等多个focus areas中任选1-2个进行深造。每位学生入学后将被分配一名Faculty Mentor（导师），该导师将帮助学生制定学术计划并解答他们可能遇到的任何问题。</p><p>研究资源：UCSD的结构工程系拥有专门设计的实验室，包括世界著名的鲍威尔结构研究实验室（Powell Structural Research Laboratories），为学生提供独特的教育和研究机会。鲍威尔实验室配备最先进的计算机控制设备，可以测试从桥梁和建筑物、船体和甲板结构到飞机机翼和结构系统的全尺寸结构系统。</p><p>此外，UCSD的结构工程系与土木工程、航空航天和海洋工程界均有着密切的工业联系。该项目还通过与UCSD Scripps海洋研究所、加州太空研究所、圣地亚哥超算中心和Los Alamos国家实验室（LANL）的密切合作而得到进一步的支持。这些合作与鲍威尔结构研究实验室相结合，为研究生和教师提供了独特的研究环境。</p>,无,无,https://www.compassedu.hk/majr_71985,无,,"工科, 土木工程, 环太平洋大学联盟, 国际公立大学论坛, 美国大学协会, 高潜力人才签证计划",是
73528,社会和行为科学硕士,MPH in Social and Behavioral Science,"社科, 公共卫生",耶鲁大学,公共卫生,秋季,2年,"51,895美元/年",无,无,无,无,申请人必须具备文学学士或理学学士学位或外国同等学历,无,无,无,无,https://www.compassedu.hk/majr_73528,无,,"社科, 公共卫生, 常春藤联盟, 美国大学协会, 全球大学校长论坛",否
74048,获取失败,获取失败,,,,,,,,,,,,,,,,https://www.compassedu.hk/majr_74048,无,,,否
74289,城市规划硕士,Master of City Planning,"社科, 建筑",加州大学伯克利分校,建筑,秋季,2年,21181.25美元,无,无,无,无,"1.GPA 3.0/4.0
2.本科阶段需要有足够的实践经验",无,无,无,无,https://www.compassedu.hk/majr_74289,无,,"社科, 建筑, 公立常春藤, 美国大学协会",否
73067,获取失败,获取失败,,,,,,,,,,,,,,,,https://www.compassedu.hk/majr_73067,无,,,否
73085,国际事务硕士,Master of International Affairs (MIA),"社科, 公共政策与事务",加州大学圣地亚哥分校,公共政策与事务,秋季,98学分,11700美元/年,无,无,真人单面,无,申请人必须从与加州大学具有同等地位的认可机构获得学士学位或同等学历，GPA3.0以上,无,"<p>UCSD 虽然是个STEM理工科学校，但 School of Global Pallcy and Strategy (GPS)学院也是专业领城很牛的存在，尤其是在做Pacific Region的Policy 和IR的research方面. MIA项目时长2年，98个学分，focusing on the Americas and Asia，专门研究太平洋地区的商业、政治、经济、发展和公共政策。项目以quant和data为特色，必修的data课只有两节，而且学生可以自由选择track（eco, politics,nonprofit,management,environment)。其实第一年跟 MPP 的课程差太不多：8节必修课 (economics,management,political science and quantitative methods training)选修课部分MIA让学生选一个career track 和一个regional specialization. 职业导向的track包括了 International Development and Nonprofit Management/International Economics/International Environmental Governance/International Management/International Politics.</p><p> </p><p>众所周知加州大学经费足，科研机会非常多。根据官方揭露，毕业生在公共、私人、非营利和多边组织中拥有成功的职业生涯，比较好的位置，包括圣地亚哥、旧金山、华盛顿特区、洛杉矶和纽约等地，雇主包括索尼、Qualcomm等大型企业。</p><p> </p><p>非常喜欢 political science 背景的学生。这个项目相比MPP招人更多一些，bar 也应该比mpp高。据就读学生来讲，GPS的chort比较大，MIA，MPP项目里美国人非常多。官方预计的项目 Size (95-100)会比 MPP(55-75)要大，但最终enroll的差不多都是 70-80。估计官方的typical size 是包括了 UCSD 本科生的five-year concurrent degree programs 的名额。申请时不限专业，托福不低于90（平均102）；平均GRE-Q: 71 percent, GRE-Verbal: 70 percent, GRE-A: 52 percent；雅思不低于7.0。</p>",无,无,https://www.compassedu.hk/majr_73085,无,,"社科, 公共政策与事务, 环太平洋大学联盟, 国际公立大学论坛, 美国大学协会, 高潜力人才签证计划",是
72843,全球政策硕士,MA in Global Policy,"社科, 公共政策与事务",波士顿大学,公共政策与事务,秋季/春季,1.5年,"61,050美元",无,无,无,无,GPA3.0及以上。,无,无,无,无,https://www.compassedu.hk/majr_72843,无,,"社科, 公共政策与事务, 美国大学协会",否
73530,传染病流行病学硕士,MS Epidemiology of Infectious Diseases,"社科, 公共卫生",耶鲁大学,公共卫生,秋季,9个月,"46,900美元",无,无,无,无,无,无,无,无,无,https://www.compassedu.hk/majr_73530,无,,"社科, 公共卫生, 常春藤联盟, 美国大学协会, 全球大学校长论坛",否
72800,公共政策硕士,Master of Public Policy,"社科, 公共政策与事务",加州大学圣地亚哥分校,公共政策与事务,秋季,两年,"40,645.99美元",无,无,真人单面,无,GPA3.0及以上。,无,无,无,无,https://www.compassedu.hk/majr_72800,无,,"社科, 公共政策与事务, 环太平洋大学联盟, 国际公立大学论坛, 美国大学协会, 高潜力人才签证计划",否
65636,法学硕士,Master of Laws,"社科, 法律",加州大学伯克利分校,法律,秋季,9个月,66530美元,无,无,无,无,不需要G,无,"<p>加州大学伯克利分校法学院开设的on-campus的Traditional Track LLM 项目。</p><p>

课程设置：除了考Bar必修的核心课程(美国法介绍、美国法基础、法律写作与调查)以外，选修课的自由度很大，而且为学生提供了丰富的certificate选择，包括Energy & Clean Technology, Law and Technology, Business Law, Environmental Law和International Law，学生可以根据自身的职业规划进行选择。。如果有明确的学术兴趣和研究计划的学生可以申请Thesis Track，当然难度会比Traditional Track大，类似Yale的LLM。</p><p>

录取方面：目标对象是在法学院的教职人员，或者考虑从事法律议题研究的人，申请需要提交legal topic的writing sample。LLM前几年经历了一波扩招，目前traditional+ thesis 2个track每届人数一共在240人左右（申请者在2500+），中国学生能占到50人左右，各种背景都有，既有工作经验丰富的国内执业律师/大公司法务，也有不少优秀的应届毕业生（本科或硕士），学校背景分布也比较广，有传统五院四系，也有普通高校，总之是T14里对中国申请者比较友好的项目（如果有海外交换经历会有加分）。</p>",无,无,https://www.compassedu.hk/majr_65636,无,,"社科, 法律, 公立常春藤, 美国大学协会",否
72847,供应链管理硕士,MS in Supply Chain Management,"商科, 供应链管理",波士顿大学,供应链管理,STEM,夏季/秋季,12-20个月,无,无,无,无,GPA3.0及以上。,无,无,无,无,https://www.compassedu.hk/majr_72847,无,,"商科, 供应链管理, 美国大学协会",是
65695,计量金融和风险分析硕士,MS in Quantitative Finance and Risk Analytics,"商科, 金工金数",伦斯勒理工学院,金工金数,STEM,春季/秋季,36学分,无,无,无,无,无,无,"<p>伦斯勒理工大学RPI量化金融与风险分析QFRA隶属于Lally 商学院，在Quantnet上排名No.23。项目整体不如同学院的BA专业。</p><p>

课程设置：1年制，课程更像Quant一点的MSF，不是特别硬核。项目CLASS SIZE比较小，正常在20+， 最新的13FT而已。</p><p>

就业方面：Quantnet2021的就业率仅为18%，起薪$72,600。</p>",无,无,https://www.compassedu.hk/majr_65695,无,,"商科, 金工金数, 私立研究型大学",是
73529,慢性病流行病学硕士,MS in Chronic Disease Epidemiology,"社科, 公共卫生",耶鲁大学,公共卫生,秋季,1年,"46,900美元",无,无,无,无,无,无,无,无,无,https://www.compassedu.hk/majr_73529,无,,"社科, 公共卫生, 常春藤联盟, 美国大学协会, 全球大学校长论坛",否
72033,生物工程工学硕士,MEng in Bioengineering,"工科, 生物工程",加州大学伯克利分校,生物工程,秋季,10个月,31195.25美元/学期,无,无,无,无,GPA至少3.0,无,<p>加州大学伯克利分校生物工程系开设有生物工程硕士（Master of Engineering in Bioengineering）：10个月，是专业硕士项目，除了生物工程领域的专业技能和知识，还未学生提供很多soft skills的培训，培养“懂技术”的管理者。项目为学生提供了7个前沿的细分领域，包括：生物工程，生物医学工程设计，生物医学成像，生物材料与生物医学设备，力学生物学，生物信息学与计算生物学，合成生物学。</p>,无,无,https://www.compassedu.hk/majr_72033,无,,"工科, 生物工程, 公立常春藤, 美国大学协会",是
72806,获取失败,获取失败,,,,,,,,,,,,,,,,https://www.compassedu.hk/majr_72806,无,,,否
73027,应用金融数学理学硕士,MS in Applied Financial Mathematics,"商科, 金工金数",康涅狄格大学,金工金数,STEM,春季/秋季,30学分,无,无,无,无,GPA3.5，申请人完成微积分、积分、多变量微积分、微分方程、线性代数和数学概率/统计学（在微积分框架中授课）的本科课程,无,无,无,无,https://www.compassedu.hk/majr_73027,无,,"商科, 金工金数, 公立常春藤, 美国竞技联盟, Universitas 21",是
72934,公共政策管理文学硕士,MA in Public Policy and Management,"社科, 公共政策与事务",俄亥俄州立大学,公共政策与事务,秋季/春季/夏季,38学分,"43,408美元/年",无,无,无,无,在申请之前需要完成Inquiry Form，需要有至少三年学士后工作经验，具备相关分析能力和行政能力,无,无,无,无,https://www.compassedu.hk/majr_72934,无,,"社科, 公共政策与事务, 美国大学协会, 大十联盟",否
72563,健康信息学硕士,MS in Health Informatics,"社科, 公共卫生",耶鲁大学,公共卫生,STEM,秋季,两年,无,无,无,无,申请人通常应拥有健康、计算机科学或数学/统计学的本科学位。 拥有硕士学位或其他相关学位的学生可以被允许注册额外的选修课程来代替必修课程，如果他们能够证明他们已经精通必修课程。,无,无,无,无,https://www.compassedu.hk/majr_72563,无,,"社科, 公共卫生, 常春藤联盟, 美国大学协会, 全球大学校长论坛",是
73639,全球研究文学硕士,MA in Global Studies,"社科, 国际关系",加州大学伯克利分校,国际关系,秋季,1年,"5,850美元",无,无,无,无,"1. 申请人本科最后两年平均GPA3.5及以上,
2. 研究亚洲人文学科（如文学、艺术、宗教或历史）的申请人更有优势",无,无,无,无,https://www.compassedu.hk/majr_73639,无,,"社科, 国际关系, 公立常春藤, 美国大学协会",否
72802,公共健康硕士,Master of Public Health,"社科, 公共卫生",加州大学圣地亚哥分校,公共卫生,秋季,64学分,"67,200美元",无,无,无,无,符合条件的学士学位学生在过去两年的课程作业中的 GPA 至少为 3.3，总 的GPA 为 3.0及以上。 学生必须在与公共卫生相关的领域有充分的准备，并表现出进行研究和实践培训的潜力。,无,无,无,无,https://www.compassedu.hk/majr_72802,无,,"社科, 公共卫生, 环太平洋大学联盟, 国际公立大学论坛, 美国大学协会, 高潜力人才签证计划",否
72933,公共管理硕士,Master of Public Administration,"社科, 公共政策与事务",俄亥俄州立大学,公共政策与事务,秋季/春季/夏季,2年,"43,488美元/年",无,无,无,无,在申请之前需要完成Inquiry Form，拥有相关人文社科背景,无,无,无,无,https://www.compassedu.hk/majr_72933,无,,"社科, 公共政策与事务, 美国大学协会, 大十联盟",否
72139,金融科技硕士,MS in Financial Technology,"商科, 金工金数",康涅狄格大学,金工金数,STEM,春季/夏季/秋季,36学分,无,无,无,无,一学期的统计或者微积分。本科总成绩或最后两年成绩3.0以上,无,"<p>University of Connecticut MS in Financial Technology康涅狄格大学金融科技硕士(FinTech)是22年新开专业，隶属于商学院，2年制，共36个学分，是STEM项目,夜课（primarily in the evening），项目共需要修36个学分，包括8门核心课程和5门选修课程，Fin or Tech 可以根据学生自己的兴趣选择。<br/>录取方面：金融、科技、商业、管理、工程、分析等专业背景。完成一学期的微积分或统计课程。22spring 第一届预计招生20人。</p>",无,无,https://www.compassedu.hk/majr_72139,无,,"商科, 金工金数, 公立常春藤, 美国竞技联盟, Universitas 21",是
65553,信息管理与系统硕士,Master of Information Management and Systems (MIMS),"商科, 信息系统",加州大学伯克利分校,信息系统,STEM,秋季,2年,无,无,无,无,"建议学生具备高级面向对象语言的基本技能水平（Python,Java,C++）",无,"<p>加州大学伯克利分校信息管理与系统硕士MIMS(Master of Information Management and Systems)是2年制项目，每年申请人数大概在350-450，每年维持录取50人左右。就业向的项目，不适合读博。</p><p>

录取方面：本科专业非常多样，文史哲都可。陆本友好。但整体录取应届生比较少，average 工作经验在5年。申请注意点在需要交一个Programming Competency Statement。有面试，基本是walk through resume。</p>",无,无,https://www.compassedu.hk/majr_65553,无,,"商科, 信息系统, 公立常春藤, 美国大学协会",是
71735,生物统计硕士,Master of Science (MS) in Biostatistics,"理科, 数学",加州大学圣地亚哥分校,数学,秋季,2年,26544美元/年,无,无,无,无,"至少学习一年的微积分(包括多元微积分); 线性代数课程; 修习统计学或计算机编程课程; 两门统计学,生物统计学和/或概率论的课程,包括一门高级课程。 还需要有统计软件包(如R、SAS、SPSS、Stata)的实用知识和/或编程经验",无,"<p>加州大学圣地亚哥分校UCSD的生物统计学硕士MS硕士隶属于Herbert Wertheim公共卫生学院(HWSPH)下的生物统计和生物信息学系，开设于2019fall, 专注于培养下一代生物统计学家。该学位课程强调教学与经验学习，旨在培训学生在数学理论、计算技能、推理方法方面分析复杂数据，并将理论数据科学的最新发展应用于生物医学数据分析的实际工具和方法。</p><p> </p><p>课程设置：</p><p>生物统计学硕士课程包括生物统计学方法和数据分析的培训，涵盖生物统计学核心课程的理论和应用，以及生命科学的选修课。核心课程包括与生物医学数据相关的数据分析项目，并介绍编程和可重复研究实践。此外，实习课程将训练学生准备和展示统计分析，使用来自生物医学或公共卫生科学合作项目的数据，并要求口头陈述和分析报告。MS课程要求完成至少56个单元的课程，预计完成时间为2年（6个季度）。</p><p> </p><p>就业方面：</p><p>学术医学中心、政府机构以及制药和生物技术行业对生物统计学家的需求日益增长。UCSD的生物统计学硕士项目以其跨学科性质和与UCSD世界一流的生物医学研究环境的合作而著称，为学生提供了丰富的职业机会。</p><p> </p><p>录取方面：</p><p>项目Size 不大，一年只招25 MS students，非常看重学生的相关背景，建议申请人至少学习一年的微积分(包括多元微积分); 线性代数课程; 修习统计学或计算机编程课程; 两门统计学，生物统计学和/或概率论的课程，包括一门高级课程。 还需要有统计软件包(如R、SAS、SPSS、Stata)的实用知识和/或编程经验。从student profile来看，美本背景居多，陆本主要录取过中南大学，浙大，北师大浸会，南信工，同济，港中深等背景的学生。</p>",无,无,https://www.compassedu.hk/majr_71735,无,,"理科, 数学, 环太平洋大学联盟, 国际公立大学论坛, 美国大学协会, 高潜力人才签证计划",否
72564,获取失败,获取失败,,,,,,,,,,,,,,,,https://www.compassedu.hk/majr_72564,无,,,否
73977,金融风险管理理学硕士,MS in Financial Risk Management,"商科, 金融",康涅狄格大学,金融,STEM,夏季/秋季/春季,15个月,无,无,无,无,"GPA3.0,最后一年GPA3.5",无,无,无,无,https://www.compassedu.hk/majr_73977,无,,"商科, 金融, 公立常春藤, 美国竞技联盟, Universitas 21",是
73846,工业与系统工程理学硕士,MS in Industrial and Systems Engineering,"工科, 工业工程",俄亥俄州立大学,工业工程,STEM,秋季/春季/夏季,至少30学分,无,无,无,无,具备相关工程类课程和基础专业知识,无,无,无,无,https://www.compassedu.hk/majr_73846,无,,"工科, 工业工程, 美国大学协会, 大十联盟",是
